{
  "$schema": "https://json-schema.org/draft/2020-12/schema",
  "$id": "https://github.com/dutchbase/ux-engineer/schemas/research.schema.json",
  "type": "object",
  "additionalProperties": false,
  "required": ["schema_version", "research_id", "product_id", "question", "route", "created_at", "source_inventory", "observations", "interpretations", "counterevidence", "gaps", "next_methods", "plan"],
  "$defs": {
    "id": {"type": "string", "pattern": "^[a-z0-9]+(?:-[a-z0-9]+)*$"},
    "strings": {"type": "array", "items": {"type": "string"}},
    "nullableString": {"type": ["string", "null"]},
    "count": {"type": ["integer", "null"], "minimum": 0}
  },
  "properties": {
    "schema_version": {"const": "1.0"},
    "research_id": {"$ref": "#/$defs/id"},
    "product_id": {"$ref": "#/$defs/id"},
    "question": {"type": "string"},
    "route": {"enum": ["web_research", "synthesis", "plan"]},
    "created_at": {"type": "string", "format": "date-time"},
    "source_inventory": {
      "type": "array",
      "items": {
        "type": "object",
        "additionalProperties": false,
        "required": ["source_id", "kind", "title", "ref", "participant_id", "date", "consent"],
        "properties": {
          "source_id": {"type": "string", "pattern": "^S-[A-Z0-9-]+$"},
          "kind": {"enum": ["interview", "support_ticket", "test_note", "survey", "analytics", "web", "other"]},
          "title": {"type": "string"},
          "ref": {"$ref": "#/$defs/nullableString"},
          "participant_id": {"$ref": "#/$defs/nullableString"},
          "date": {"oneOf": [{"type": "string", "format": "date"}, {"type": "null"}]},
          "consent": {"enum": ["not_applicable", "obtained", "unknown"]}
        }
      }
    },
    "observations": {
      "type": "array",
      "items": {
        "type": "object",
        "additionalProperties": false,
        "required": ["observation_id", "text", "source_ids"],
        "properties": {
          "observation_id": {"type": "string", "pattern": "^O-[A-Z0-9-]+$"},
          "text": {"type": "string"},
          "source_ids": {"type": "array", "minItems": 1, "items": {"type": "string"}}
        }
      }
    },
    "interpretations": {
      "type": "array",
      "items": {
        "type": "object",
        "additionalProperties": false,
        "required": ["interpretation_id", "text", "observation_ids", "people_count", "report_count", "confidence", "confidence_reason", "status"],
        "properties": {
          "interpretation_id": {"type": "string", "pattern": "^I-[A-Z0-9-]+$"},
          "text": {"type": "string"},
          "observation_ids": {"type": "array", "minItems": 1, "items": {"type": "string"}},
          "people_count": {"$ref": "#/$defs/count"},
          "report_count": {"$ref": "#/$defs/count"},
          "confidence": {"enum": ["high", "medium", "low"]},
          "confidence_reason": {"type": "string"},
          "status": {"enum": ["supported", "hypothesis"]}
        }
      }
    },
    "counterevidence": {
      "type": "array",
      "items": {
        "type": "object",
        "additionalProperties": false,
        "required": ["text", "source_ids"],
        "properties": {
          "text": {"type": "string"},
          "source_ids": {"type": "array", "items": {"type": "string"}}
        }
      }
    },
    "gaps": {"$ref": "#/$defs/strings"},
    "next_methods": {
      "type": "array",
      "items": {
        "type": "object",
        "additionalProperties": false,
        "required": ["method", "question", "participants", "notes"],
        "properties": {
          "method": {"type": "string"},
          "question": {"type": "string"},
          "participants": {"type": "string"},
          "notes": {"$ref": "#/$defs/nullableString"}
        }
      }
    },
    "plan": {
      "oneOf": [
        {"type": "null"},
        {
          "type": "object",
          "additionalProperties": false,
          "required": ["research_questions", "screener", "tasks", "consent_and_data"],
          "properties": {
            "research_questions": {"$ref": "#/$defs/strings"},
            "screener": {"$ref": "#/$defs/strings"},
            "tasks": {"$ref": "#/$defs/strings"},
            "consent_and_data": {"type": "string"}
          }
        }
      ]
    }
  }
}
